{
  "id": "characterai",
  "name": "Character.AI",
  "kind": "closed-companion-app",
  "repo": null,
  "docs": "https://blog.character.ai/memory/",
  "license": null,
  "stars_observed": null,
  "observed_at": "2026-09-11",
  "ontology_notes": "Official product memory: Pinned Memories / Story Memory (pin messages, 5 free, 2x on c.ai+), Chat Memories (up to 400 characters of fixed text, 2025 blog), Facts tabs for Persona / Character / side characters (c.ai+, auto-capture plus manual add/edit/disable). Memory Usage bar. Lorebook mentioned as upcoming. Internals INCONCLUSIVE.",
  "dimensions": {
    "ontology": {
      "score": "partial",
      "evidence": "Help/blog name pins, story memory, facts (persona/character/side), chat memories. Facts are the closest to typed entities. No public relationship_state type. Internals INCONCLUSIVE.",
      "label": "measured"
    },
    "write_policy": {
      "score": "partial",
      "evidence": "User pins. User writes Chat Memories. Facts auto-captured and user-editable (c.ai+). Background 'tidies older context'. Extractor internals INCONCLUSIVE.",
      "label": "measured"
    },
    "read_policy": {
      "score": "partial",
      "evidence": "Pins and written Story Memory are protected as Memory fills. Help: limited conversation context so characters forget if not recent (2024 article). 2026 blog: cannot guarantee the Character uses written memory exactly. Internals INCONCLUSIVE.",
      "label": "measured"
    },
    "supersession": {
      "score": "partial",
      "evidence": "Unpin, disable/remove Facts, overwrite Chat Memories. Copy Facts to a new chat is optional. How auto-facts conflict is unpublished. Internals INCONCLUSIVE.",
      "label": "inferred"
    },
    "temporal": {
      "score": "unknown",
      "evidence": "No public dated query. Memory Usage implies a budget that fills over a long chat. Internals INCONCLUSIVE.",
      "label": "guess"
    },
    "identity_split": {
      "score": "partial",
      "evidence": "Facts tabs split Persona, Character, and side characters. Pins are per chat. New chat can copy or start fresh. Internals INCONCLUSIVE.",
      "label": "measured"
    },
    "silence": {
      "score": "partial",
      "evidence": "Disable a Fact, unpin, start fresh chat. No documented spoiler/trauma suppressor. Internals INCONCLUSIVE.",
      "label": "inferred"
    },
    "poisoning": {
      "score": "unknown",
      "evidence": "Auto-captured Facts could store jokes as character canon. No public trust tags. Internals INCONCLUSIVE.",
      "label": "guess"
    },
    "forgetting": {
      "score": "partial",
      "evidence": "Unpin, remove Facts, do not copy Facts to new chat. Help still warns characters forget when context is exceeded. Internals INCONCLUSIVE.",
      "label": "measured"
    },
    "cost_shape": {
      "score": "partial",
      "evidence": "Public limits: 5 pins (10 on plus), 400-character Chat Memories. Memory Usage visualization. Per-turn extract cost unpublished. Internals INCONCLUSIVE.",
      "label": "measured"
    },
    "local": {
      "score": "absent",
      "evidence": "Closed hosted app. No self-host of Character.AI memory.",
      "label": "measured"
    },
    "mcp": {
      "score": "absent",
      "evidence": "No official MCP server in help/blog reviewed.",
      "label": "measured"
    }
  },
  "assumes_retrieve_equals_remember": "yes",
  "companion_fit": "PARTIAL",
  "companion_fit_reason": "Pinned backstory plus auto facts is the hosted version of ST's always-on note plus extract. The vendor says they cannot guarantee the character uses it. No public typed relationship state. Internals INCONCLUSIVE.",
  "published_eval": {
    "name": null,
    "claimed_score": null,
    "what_it_actually_scores": null,
    "source": null
  },
  "sources": [
    "https://blog.character.ai/memory/",
    "https://blog.character.ai/helping-characters-remember-what-matters-most/",
    "https://support.character.ai/hc/en-us/articles/24327914463003-New-Feature-Pinned-Memories",
    "https://support.character.ai/hc/en-us/articles/15063870278171-Why-do-Characters-forget-things"
  ],
  "open_unknowns": [
    "Engine internals (closed).",
    "Whether Lorebook has shipped since the May 2026 blog 'soon' note.",
    "Exact auto-memory vs Facts overlap."
  ]
}
