{
  "id": "mem0-mcp",
  "name": "Mem0 MCP (archived stdio server; hosted replacement)",
  "kind": "mcp-server",
  "repo": "https://github.com/mem0ai/mem0-mcp",
  "docs": "https://docs.mem0.ai/platform/mem0-mcp",
  "license": "Apache-2.0",
  "stars_observed": 660,
  "observed_at": "2026-09-11",
  "ontology_notes": "The archived server is a FastMCP wrapper around mem0.MemoryClient. It stores untyped text/messages under user_id, agent_id, app_id, run_id. No companion types. GitHub archived the repo on 2026-03-24. Replacement is hosted HTTPS MCP at https://mcp.mem0.ai/mcp with the same tool names plus list_events and get_event_status. Memory extraction and graph live in Mem0 Platform, not this repo.",
  "dimensions": {
    "ontology": {
      "score": "absent",
      "evidence": "src/mem0_mcp_server/server.py add_memory takes text or role/content messages. No schema for bio, character, relationship, or lore. Scopes are user_id/agent_id/app_id/run_id only.",
      "label": "measured"
    },
    "write_policy": {
      "score": "present",
      "evidence": "Tool add_memory. Hosted docs: the agent decides when to save, look up, or update. Archived server calls MemoryClient.add. Requires user_id, agent_id, or run_id. Default user is env MEM0_DEFAULT_USER_ID or mem0-mcp.",
      "label": "measured"
    },
    "read_policy": {
      "score": "present",
      "evidence": "search_memories is semantic search via MemoryClient.search. get_memories pages with filters. get_memory by memory_id. Hosted docs list the same tools. Empty search is allowed.",
      "label": "measured"
    },
    "supersession": {
      "score": "partial",
      "evidence": "update_memory overwrites text by memory_id (client.update). add_memory does not document in-place replace in this repo. Consolidation is whatever Mem0 Platform does, not visible here.",
      "label": "measured"
    },
    "temporal": {
      "score": "partial",
      "evidence": "search_memories docstring shows created_at gte filters. No last-Tuesday parser in this server.",
      "label": "measured"
    },
    "identity_split": {
      "score": "partial",
      "evidence": "Filters and add_memory accept user_id, agent_id, app_id, run_id. That is coding-agent scope, not user vs character vs relationship.",
      "label": "measured"
    },
    "silence": {
      "score": "absent",
      "evidence": "No skip, redact, or social-context gate on search_memories. Ranking is Mem0 semantic search.",
      "label": "measured"
    },
    "poisoning": {
      "score": "absent",
      "evidence": "No content filter or trust tag in server.py. Stored text is returned as JSON from Mem0.",
      "label": "measured"
    },
    "forgetting": {
      "score": "present",
      "evidence": "delete_memory, delete_all_memories, delete_entities in archived server.py. Hosted docs keep those tools.",
      "label": "measured"
    },
    "cost_shape": {
      "score": "unknown",
      "evidence": "This repo does not run extract. MemoryClient.add is a Mem0 Platform call. LLM and embed cost per turn is not specified here.",
      "label": "inferred"
    },
    "local": {
      "score": "absent",
      "evidence": "Archived server requires MEM0_API_KEY and MemoryClient. Hosted docs: nothing runs on your machine, memories live in the Mem0 account.",
      "label": "measured"
    },
    "mcp": {
      "score": "present",
      "evidence": "Official Mem0 MCP. Archived GitHub stdio server plus hosted https://mcp.mem0.ai/mcp. docs.mem0.ai/platform/mem0-mcp.",
      "label": "measured"
    }
  },
  "assumes_retrieve_equals_remember": "yes",
  "companion_fit": "MISFIT",
  "companion_fit_reason": "Thin MCP over Mem0 Platform fact tools. No companion ontology, no local intimate store, no silence. Archived in March 2026 and replaced by a hosted server.",
  "published_eval": {
    "name": null,
    "claimed_score": null,
    "what_it_actually_scores": "This MCP wrapper publishes no eval. Mem0 OSS/platform scores belong on the mem0 card.",
    "source": null
  },
  "sources": [
    "https://github.com/mem0ai/mem0-mcp/blob/main/src/mem0_mcp_server/server.py",
    "https://github.com/mem0ai/mem0-mcp/blob/main/README.md",
    "https://docs.mem0.ai/platform/mem0-mcp",
    "https://github.com/mem0ai/mem0-mcp/blob/main/LICENSE"
  ],
  "open_unknowns": [
    "Exact extract/update algorithm is in Mem0 Platform, not this archive.",
    "Hosted MCP tool list vs archived server.py may drift after 2026-03-24."
  ]
}
