{
  "id": "locomo-plus",
  "name": "LoCoMo-Plus",
  "kind": "eval-benchmark",
  "repo": "https://github.com/xjtuleeyf/Locomo-Plus",
  "docs": "https://arxiv.org/abs/2602.10715",
  "license": null,
  "stars_observed": 37,
  "observed_at": "2026-09-11",
  "ontology_notes": "Real public dataset and harness. Extends LoCoMo with a sixth Cognitive category. Cue-trigger pairs are generated from scratch, human-filtered, then stitched into LoCoMo trajectories under cue-trigger semantic disconnect. Cognitive memory is decomposed into causal, state, goal, and value constraints. Unified eval uses constraint consistency and an LLM judge (correct=1, partial=0.5, wrong=0), without disclosing task type. GitHub ships locomo_plus.json plus locomo10.json. ACL 2026 long paper 2026.acl-long.1150.",
  "dimensions": {
    "ontology": {
      "score": "absent",
      "evidence": "eval, not a memory engine",
      "label": "measured"
    },
    "write_policy": {
      "score": "absent",
      "evidence": "eval, not a memory engine",
      "label": "measured"
    },
    "read_policy": {
      "score": "absent",
      "evidence": "eval, not a memory engine",
      "label": "measured"
    },
    "supersession": {
      "score": "absent",
      "evidence": "Cognitive cases apply a latent constraint. They do not score overwriting an old biographical fact with a newer one.",
      "label": "measured"
    },
    "temporal": {
      "score": "partial",
      "evidence": "Each cue-query pair has a temporal gap indicator t. Triggers are specified as at least one week or months later in the generation prompt (paper appendix). Still not a companion time-skip reunion.",
      "label": "measured"
    },
    "identity_split": {
      "score": "absent",
      "evidence": "Same two-speaker LoCoMo chats plus inserted cues. No character vs user vs relationship vs lore types.",
      "label": "measured"
    },
    "silence": {
      "score": "partial",
      "evidence": "The exam-prep vs TV-series example requires not recommending a distraction. That is constraint-consistent behavior, closer to social timing than fact F1. It is still not trauma, kink, spoiler, or 'do not recall this'.",
      "label": "measured"
    },
    "poisoning": {
      "score": "absent",
      "evidence": "No stored-memory jailbreak or persona overwrite cases. Limitations section says the bench does not model multi-agent memory or long-term belief revision.",
      "label": "measured"
    },
    "forgetting": {
      "score": "absent",
      "evidence": "No forget-that items in the six categories (LoCoMo five plus Cognitive).",
      "label": "measured"
    },
    "cost_shape": {
      "score": "absent",
      "evidence": "Scores are judge consistency and the LoCoMo-to-Plus gap. Figure 7 studies length sensitivity. No tokens-per-turn cost.",
      "label": "measured"
    },
    "local": {
      "score": "partial",
      "evidence": "Public GitHub pipeline. No LICENSE file in the repo listing. Judge and generation default to OpenAI-compatible APIs.",
      "label": "measured"
    },
    "mcp": {
      "score": "absent",
      "evidence": "eval, not a memory engine",
      "label": "measured"
    }
  },
  "assumes_retrieve_equals_remember": "mixed",
  "companion_fit": "PARTIAL",
  "companion_fit_reason": "Would slightly prefer systems that apply implicit user constraints when the later query does not look like the cue. That is closer to companion social memory than LoCoMo F1. It would not select for character identity, poisoning, forget, or RP lore.",
  "published_eval": {
    "name": "LoCoMo-Plus",
    "claimed_score": "Paper Table 1. Cognitive column is LoCoMo-Plus. gemini-2.5-pro 26.06 with factual average 71.78 (gap 45.72). gpt-4o 21.05 vs 62.99. Mem0 15.80 vs factual 57.24 (gap 41.44). A-Mem 17.20 vs 59.64. All methods stay low on cognitive.",
    "what_it_actually_scores": "Whether a later response stays consistent with an implicit causal, state, goal, or value constraint planted earlier, when the trigger is semantically distant from the cue. Also reruns LoCoMo's five factual types under the unified judge.",
    "source": "https://arxiv.org/abs/2602.10715"
  },
  "sources": [
    "https://github.com/xjtuleeyf/Locomo-Plus",
    "https://arxiv.org/abs/2602.10715",
    "https://arxiv.org/html/2602.10715",
    "https://aclanthology.org/2026.acl-long.1150/"
  ],
  "open_unknowns": [
    "Exact count of cognitive instances is not stated as a single number in the paper HTML. GitHub README does not print N. Third-party blogs citing 401 are not used.",
    "Repo has no LICENSE file."
  ]
}
